{
  "pipeline_schema_version": "2.0",
  "package_id": "lora-a",
  "version": "1.2.0",
  "role": "LORA_A",
  "created_at": "2026-10-15T00:00:00Z",
  "runtime_contract_version": 1,
  "base_model": {
    "id": "Qwen/Qwen2.5-1.5B-Instruct",
    "revision": "r1"
  },
  "adapter_hash": "sha256:0000000000000000000000000000000000000000000000000000000000000000",
  "serving_config": {},
  "serving_config_hash": "sha256:0000000000000000000000000000000000000000000000000000000000000000",
  "system_prompt": {
    "path": "system_prompt.txt",
    "sha256": "sha256:3def1bd06bba07ed86b77771064fc0dc969cc80f2997f159ee80b3de5b228b93"
  },
  "lineage": {
    "dataset": {
      "id": "ds-1",
      "version": "1",
      "content_hash": "sha256:0000000000000000000000000000000000000000000000000000000000000000"
    },
    "training_run_id": "run-1",
    "turn_engine_version": "0.1.0",
    "model_runtime_version": "0.1.0",
    "question_sets": [
      {
        "id": "qs-main",
        "version": "3",
        "content_hash": "sha256:0000000000000000000000000000000000000000000000000000000000000000"
      }
    ]
  },
  "eval_report_ref": "eval-7",
  "content_hash": "sha256:0000000000000000000000000000000000000000000000000000000000000000"
}
